{
	"identifier": "Level_1",
	"uniqueIdentifer": "b0715130-c640-11ed-b889-ad3385c5253f",
	"x": 672,
	"y": 0,
	"width": 160,
	"height": 160,
	"bgColor": "#696A79",
	"neighbourLevels": [],
	"customFields" : {},
	"layers": [
		"Background.png",
		"Platforms.png",
		"Spikes.png",
		"Ladders.png"
	],
	"entities" : {}
}