{
	"identifier": "Level_14",
	"uniqueIdentifer": "bde5af00-c640-11ed-b889-91ab422981bb",
	"x": 448,
	"y": 448,
	"width": 160,
	"height": 160,
	"bgColor": "#696A79",
	"neighbourLevels": [],
	"customFields" : {},
	"layers": [
		"Background.png",
		"Platforms.png",
		"Spikes.png",
		"Ladders.png"
	],
	"entities" : {}
}