{
	"identifier": "Level_10",
	"uniqueIdentifer": "580b0c60-c640-11ed-b889-f985e5ed927f",
	"x": 1120,
	"y": 224,
	"width": 160,
	"height": 160,
	"bgColor": "#696A79",
	"neighbourLevels": [],
	"customFields" : {},
	"layers": [
		"Background.png",
		"Platforms.png",
		"Spikes.png",
		"Ladders.png"
	],
	"entities" : {}
}