{
	"identifier": "Level_5",
	"uniqueIdentifer": "a45bcaa0-c640-11ed-b889-d76408c34894",
	"x": 1568,
	"y": 0,
	"width": 160,
	"height": 160,
	"bgColor": "#696A79",
	"neighbourLevels": [],
	"customFields" : {},
	"layers": [
		"Background.png",
		"Platforms.png",
		"Spikes.png",
		"Ladders.png"
	],
	"entities" : {}
}