{
	"identifier": "Level_12",
	"uniqueIdentifer": "ba720c14-c640-11ed-b889-1fd0084f11dd",
	"x": 1568,
	"y": 224,
	"width": 160,
	"height": 160,
	"bgColor": "#696A79",
	"neighbourLevels": [],
	"customFields" : {},
	"layers": [
		"Background.png",
		"Platforms.png",
		"Spikes.png",
		"Ladders.png"
	],
	"entities" : {}
}