{
	"identifier": "Level_6",
	"uniqueIdentifer": "b8639e73-c640-11ed-b889-a1a15ba4aa3d",
	"x": 1792,
	"y": 0,
	"width": 160,
	"height": 160,
	"bgColor": "#696A79",
	"neighbourLevels": [],
	"customFields" : {},
	"layers": [
		"Background.png",
		"Platforms.png",
		"Spikes.png",
		"Ladders.png"
	],
	"entities" : {}
}