{
	"identifier": "Level_7",
	"uniqueIdentifer": "11f4d940-c640-11ed-b889-8d9dab1180ec",
	"x": 448,
	"y": 224,
	"width": 160,
	"height": 160,
	"bgColor": "#696A79",
	"neighbourLevels": [],
	"customFields" : {},
	"layers": [
		"Background.png",
		"Platforms.png",
		"Spikes.png",
		"Ladders.png"
	],
	"entities" : {}
}