{
	"identifier": "Level_0",
	"uniqueIdentifer": "3f943c70-9f30-11ed-95b7-e9fada14ed55",
	"x": 448,
	"y": 0,
	"width": 160,
	"height": 160,
	"bgColor": "#696A79",
	"neighbourLevels": [],
	"customFields" : {},
	"layers": [
		"Background.png",
		"Platforms.png",
		"Spikes.png",
		"Ladders.png"
	],
	"entities" : {}
}