{
	"identifier": "Level_2",
	"uniqueIdentifer": "b3f7dfe0-c640-11ed-b889-4bdc59cec5f1",
	"x": 896,
	"y": 0,
	"width": 160,
	"height": 160,
	"bgColor": "#696A79",
	"neighbourLevels": [],
	"customFields" : {},
	"layers": [
		"Background.png",
		"Platforms.png",
		"Spikes.png",
		"Ladders.png"
	],
	"entities" : {}
}