{
	"identifier": "Level_9",
	"uniqueIdentifer": "35f6d5f0-c640-11ed-b889-f12c4e47ccbc",
	"x": 896,
	"y": 224,
	"width": 160,
	"height": 160,
	"bgColor": "#696A79",
	"neighbourLevels": [],
	"customFields" : {},
	"layers": [
		"Background.png",
		"Platforms.png",
		"Spikes.png",
		"Ladders.png"
	],
	"entities" : {}
}