{
	"identifier": "Level_8",
	"uniqueIdentifer": "1b5e5d30-c640-11ed-b889-ff316a9cc938",
	"x": 672,
	"y": 224,
	"width": 160,
	"height": 160,
	"bgColor": "#696A79",
	"neighbourLevels": [],
	"customFields" : {},
	"layers": [
		"Background.png",
		"Platforms.png",
		"Spikes.png",
		"Ladders.png"
	],
	"entities" : {}
}