{
	"identifier": "Level_11",
	"uniqueIdentifer": "615d85e0-c640-11ed-b889-e9598c4c8916",
	"x": 1344,
	"y": 224,
	"width": 160,
	"height": 160,
	"bgColor": "#696A79",
	"neighbourLevels": [],
	"customFields" : {},
	"layers": [
		"Background.png",
		"Platforms.png",
		"Spikes.png",
		"Ladders.png"
	],
	"entities" : {}
}