{
	"identifier": "Level_4",
	"uniqueIdentifer": "85e2e360-c640-11ed-b889-bf18c556acca",
	"x": 1344,
	"y": 0,
	"width": 160,
	"height": 160,
	"bgColor": "#696A79",
	"neighbourLevels": [],
	"customFields" : {},
	"layers": [
		"Background.png",
		"Platforms.png",
		"Spikes.png",
		"Ladders.png"
	],
	"entities" : {}
}