{
	"identifier": "Level_3",
	"uniqueIdentifer": "b62176a0-c640-11ed-b889-d3cb7e318c7c",
	"x": 1120,
	"y": 0,
	"width": 160,
	"height": 160,
	"bgColor": "#696A79",
	"neighbourLevels": [],
	"customFields" : {},
	"layers": [
		"Background.png",
		"Platforms.png",
		"Spikes.png",
		"Ladders.png"
	],
	"entities" : {}
}