{
	"identifier": "Level_13",
	"uniqueIdentifer": "bc674c60-c640-11ed-b889-fdb82f897fea",
	"x": 1792,
	"y": 224,
	"width": 160,
	"height": 160,
	"bgColor": "#696A79",
	"neighbourLevels": [],
	"customFields" : {},
	"layers": [
		"Background.png",
		"Platforms.png",
		"Spikes.png",
		"Ladders.png"
	],
	"entities" : {}
}